序号,刊物简称,刊物全称,出版社,网址,学科,文章类别,CCF级别
545,UbiComp,ACM International Conference on Ubiquitous Computing,ACM,http://dblp.uni-trier.de/db/conf/huc/,人机交互与普适计算,会议,A
546,CSCW,ACM Conference on Computer Supported Cooperative Work and Social Computing,ACM,http://dblp.uni-trier.de/db/conf/cscw,人机交互与普适计算,会议,A
547,IUI,ACM International Conference on Intelligent User Interfaces,ACM,http://dblp.uni-trier.de/db/conf/iui/,人机交互与普适计算,会议,B
548,ITS,ACM International Conference on Interactive Tabletops and Surfaces,ACM,http://dblp.uni-trier.de/db/conf/tabletop/,人机交互与普适计算,会议,B
549,UIST,ACM Symposium on User Interface Software and Technology,ACM,http://dblp.uni-trier.de/db/conf/uist/,人机交互与普适计算,会议,B
550,ECSCW,European Computer Supported Cooperative Work,Springer,http://dblp.uni-trier.de/db/conf/ecscw/,人机交互与普适计算,会议,B
551,MobileHCI,International Conference on Human Computer Interaction with Mobile Devices and Services,ACM,http://dblp.uni-trier.de/db/conf/mhci/,人机交互与普适计算,会议,B
552,PERCOM,IEEE International Conference on Pervasive Computing and Communications,IEEE,http://dblp.uni-trier.de/db/conf/percom/,人机交互与普适计算,会议,B
553,GROUP,ACM Conference on Supporting Group Work,ACM,http://dblp.uni-trier.de/db/conf/group/,人机交互与普适计算,会议,B
554,ASSETS,ACM SIGACCESS Conference on Computers and Accessibility,ACM,http://dblp.uni-trier.de/db/conf/assets,人机交互与普适计算,会议,C
555,DIS,ACM Conference on Designing Interactive Systems,ACM,http://dblp.uni-trier.de/db/conf/ACMdis/,人机交互与普适计算,会议,C
556,GI,Graphics Interface conference,ACM,http://dblp.uni-trier.de/db/conf/graphicsinterface/,人机交互与普适计算,会议,C
557,MobiQuitous,"International Conference on Mobile and Ubiquitous Systems: Computing,Networking and Services",Springer,http://dblp.uni-trier.de/db/conf/mobiquitous/,人机交互与普适计算,会议,C
558,INTERACT,IFIP TC13 Conference on Human-Computer Interaction,IFIP,http://dblp.uni-trier.de/db/conf/interact/,人机交互与普适计算,会议,C
559,CoopIS,International Conference on Cooperative Information Systems,Springer,http://dblp.uni-trier.de/db/conf/coopis/,人机交互与普适计算,会议,C
560,ICMI ,ACM International Conference on Multimodal Interaction,ACM,http://dblp.uni-trier.de/db/conf/icmi/,人机交互与普适计算,会议,C
561,IDC,Interaction Design and Children,ACM,http://dblp.uni-trier.de/db/conf/acmidc/,人机交互与普适计算,会议,C
562,AVI,International Working Conference on Advanced Visual Interfaces,ACM,http://dblp.uni-trier.de/db/conf/avi/,人机交互与普适计算,会议,C
563,UIC,IEEE International Conference on Ubiquitous Intelligence and Computing,IEEE,http://dblp.uni-trier.de/db/conf/uic/,人机交互与普适计算,会议,C
564,DIS,ACM Conference on Designing Interactive  Systems,ACM,http://dblp.uni-trier.de/db/conf/ACMdis,人机交互与普适计算,会议,C
565,,IEEE World Haptics Conference,IEEE,http://dblp.uni-trier.de/db/conf/haptics/,人机交互与普适计算,会议,C
566,CSCWD,International Conference on Computer Supported Cooperative Work in Design,Springer,http://dblp.uni-trier.de/db/conf/cscwd/,人机交互与普适计算,会议,C
567,Collaborate Com,International Conference on Collaborative Computing,Springer,http://collaboratecom.org,人机交互与普适计算,会议,C
568,Proc. IEEE,Proceedings of the IEEE,IEEE,http://dblp.uni-trier.de/db/journals/pieee/,交叉/新兴/综合,期刊,A
569,JACM,Journal of the ACM,ACM,http://dblp.uni-trier.de/db/journals/jacm/,交叉/新兴/综合,期刊,A
570,,Bioinformatics,Oxford University Press,http://dblp.uni-trier.de/db/journals/bioinformatics/,交叉/新兴/综合,期刊,B
571,,Briefings in Bioinformatics,Oxford University Press,http://dblp.uni-trier.de/db/journals/bib/,交叉/新兴/综合,期刊,B
572,Cognition,Cognition：International Journal of Cognitive Science,Elsevier,http://www.journals.elsevier.com/cognition/,交叉/新兴/综合,期刊,B
573,,PLOS Computational Biology,Public Library of Science,http://dblp.uni-trier.de/db/journals/ploscb/,交叉/新兴/综合,期刊,B
574,TMI,IEEE Transactions on Medical Imaging,IEEE,http://dblp.uni-trier.de/db/journals/tmi/,交叉/新兴/综合,期刊,B
575,TGARS,IEEE Transactions on Geoscience and Remote Sensing,IEEE,http://dblp.uni-trier.de/db/journals/tgrs/,交叉/新兴/综合,期刊,B
576,TITS,IEEE Transactions on Intelligent Transportation Systems,IEEE,http://dblp.uni-trier.de/db/journals/tits/,交叉/新兴/综合,期刊,B
577,TR,IEEE Transactions on Robotics,IEEE,http://dblp.uni-trier.de/db/journals/trob/,交叉/新兴/综合,期刊,B
578,TASAE,IEEE Transactions on Automation Science and Engineering,IEEE,http://dblp.uni-trier.de/db/journals/tase/,交叉/新兴/综合,期刊,B
579,JCST,Journal of Computer Science and Technology,SCIENCE PRESS/Springer,http://dblp.uni-trier.de/db/journals/jcst/,交叉/新兴/综合,期刊,B
580,JAMIA,Journal of the American Medical Informatics Association,BMJ Journals,http://dblp.uni-trier.de/db/journals/jamia/,交叉/新兴/综合,期刊,B
581,,Science China Information Sciences,Science in China Press/Springer,http://dblp.uni-trier.de/db/journals/chinaf/,交叉/新兴/综合,期刊,B
582,,The Computer Journal,Oxford University Press,http://dblp.uni-trier.de/db/journals/cj/,交叉/新兴/综合,期刊,B
583,,World Wide Web Journal,Springer,http://dblp.uni-trier.de/db/journals/wwwj/,交叉/新兴/综合,期刊,B
584,,BMC Bioinformatics,BioMed Central,http://dblp.uni-trier.de/db/journals/bmcbi/,交叉/新兴/综合,期刊,C
585,,Cybernetics and Systems,Taylor & Francis,http://dblp.uni-trier.de/db/journals/cas/,交叉/新兴/综合,期刊,C
586,,IEEE Geoscience and Remote Sensing Letters,IEEE,http://dblp.uni-trier.de/db/journals/lgrs/,交叉/新兴/综合,期刊,C
587,TITB,IEEE Transactions on Information Technology in Biomedicine,IEEE,http://dblp.uni-trier.de/db/journals/titb/,交叉/新兴/综合,期刊,C
588,TCBB,IEEE-ACM Transactions on Computational Biology and Bioinformatics,IEEE/ACM,http://dblp.uni-trier.de/db/journals/tcbb/,交叉/新兴/综合,期刊,C
589,,IET Intelligent Transport Systems,IET,http://digital-library.theiet.org/content/journals/iet-its,交叉/新兴/综合,期刊,C
590,,Medical Image Analysis,Elsevier,http://dblp.uni-trier.de/db/journals/mia/,交叉/新兴/综合,期刊,C
591,FCS,Frontiers of Computer Science,Higher Education Press,http://dblp.uni-trier.de/db/journals/fcsc/,交叉/新兴/综合,期刊,C
592,RTSS,Real-Time Systems Symposium,IEEE,http://dblp.uni-trier.de/db/conf/rtss/,交叉/新兴/综合,会议,A
593,WWW,International World Wide Web Conferences,ACM,http://dblp.uni-trier.de/db/conf/www/,交叉/新兴/综合,会议,A
594,EMSOFT,International Conference on Embedded Software,ACM/IEEE/IFIP,http://dblp.uni-trier.de/db/conf/emsoft/,交叉/新兴/综合,会议,B
595,ISMB,International conference on Intelligent Systems for Molecular Biology,Oxford Journals,http://www.iscb.org/about-ismb,交叉/新兴/综合,会议,B
596,CogSci,Cognitive Science Society Annual Conference,Psychology Press,http://cognitivesciencesociety.org/conference2013/index.ht ml,交叉/新兴/综合,会议,B
597,RECOMB,International Conference on Research in Computational Molecular Biology,Springer,http://dblp.uni-trier.de/db/conf/recomb/,交叉/新兴/综合,会议,B
598,BIBM,IEEE International Conference on Bioinformatics and Biomedicine,IEEE,http://dblp.uni-trier.de/db/conf/bibm/,交叉/新兴/综合,会议,B
599,AMIA,American Medical Informatics Association Annual Symposium,AMIA,http://dblp.uni-trier.de/db/conf/amia/,交叉/新兴/综合,会议,C
600,APBC,Asia Pacific Bioinformatics Conference,BioMed Central,http://dblp.uni-trier.de/db/conf/apbc/,交叉/新兴/综合,会议,C
601,COSIT,International Conference on Spatial Information Theory,ACM,http://dblp.uni-trier.de/db/conf/cosit/,交叉/新兴/综合,会议,C
602,,IEEE International Conference on Cloud Computing,IEEE,http://dblp.uni-trier.de/db/conf/IEEEcloud/,交叉/新兴/综合,会议,C
0,WVoT,Web Velocity and the Web of Things,,,,会议,N
0,CBMS,International Symposium on Computer-Based Medical Systems,,,,会议,N
0,WISTP,International Conference on Information Security Theory and Practice,,,,会议,N
0,IEEE HMData,Human-in-the-loop Methods and Human-Machine Collaboration in Big Data,,,,会议,N
0,ICAIIC,International Conference on Artificial Intelligence in Information and Communication,,,,会议,N
0,FLAIRS,AI for Internet of Things and Fab Labs/Maker Spaces,,,,会议,N
0,IIKE,International Workshop on Intelligence & Interaction in Knowledge Engineering,,,,会议,N
0,MUE,Multimedia and Ubiquitous Engineering,,,,会议,N
0,IEEE BigData,IEEE BigData,,,,会议,N
0,BPOD,IEEE International Workshop on Benchmarking, Performance Tuning and Optimization for Big Data Applications,,,,会议,N
0,MIPR,The IEEE International Conference on Multimedia Information Processing and Retrieval,,,,会议,N
